turkish_horse_archers	Borderland Turks	Etrâk-i Uc	Etrâk is a word found in many Middle Eastern sources not least in the later Turkish Ottoman period as a reference to their own kind. Historically, all of the Western or Oghuz Turks have been called Türkmen or Turkoman. The word Etrâk was most well-known referring to the warrior units called Uci. Uc means border in Turkic, and were literally men of the borderlands, they joined the campaigns under the command of Amirs, and proved their worth as hardened soldiers, fast and excellent cavalry as a rule, all Turks were horse archers, with mixed equipment but always with the standard silk armour and recurved bow. 	PLACEHOLDER HORSE ARCHERS	horse archers	small unit, lesser rec pool, very cheap, good stats	-	-	Turks	-	-	yes	freemen	superior		BASE:silk, UP1: leather cuirass, UP2: chainmail, UP3: lamellar, SHIELD: , HELMET: 	Nomad bow	scimitar/metalheaded mace	-	-	-	-	cavalry	missile	light	English	main_missile	-	-	Cuman_Horse_Archers	32	0	1	-	-	-	-	-	-	fast pony	elephant -4, camel -4	-	sea_faring, hide_forest, can_withdraw, cantabrian_circle, mercenary_unit, general_unit	2, 4.4	3, 6	3	square	1	0	6	1	cav_composite_arrow	125	25	missile	missile_mechanical	piercing	none	,	25	1	-	-	-	no	6	2	no	0	0	melee	melee_blade	piercing	sword	,	25	1	-	-	-	no	0	3	0	flesh	0	0	flesh	0	0	0	-6	1	4	3	normal	untrained	45	0	-	-	1	380	180	90	70	380	4	90	-	0	Cuman_Horse_Archers	turks, byzantium	turks, byzantium	turks, byzantium	turks, byzantium	-	1
turkish_spearmen	Soldiers of Rum	Rûmî	When the Turks overran Anatolia after the Battle of Manzikert in 1071 the majority of the subject population were of different ethnic groups (non-Turks) but culturally they were unified Romans (Byzantines). The Romans (Rûmî) continued a tradition of suburban feudalism, living on semi-rural estates spread out in the valleys, slopes and outskirts of the vast sprawling cities they were generally speaking civilised and had a tradition as well-equipped, dependable levies.	PLACEHOLDER LIGHT INFANTRY	light infantry	Roman militia	-	-	Turks	Anatolia	-	-	freemen	levy		BASE:unarmored, UP1: leather, UP2: padded, UP3: mail, SHIELD: yes , HELMET: yes	Lanzalonga	military axe short	-	-	-	-	infantry	spearmen	light	English	main_spear	-	-	Levy_Spearmen	60	0	1	-	-	-	-	-	-	-	-	-	sea_faring, hide_forest, can_withdraw, general_unit	 1.2, 1.2	2.4, 2.4	5	square, schiltrom	1	0	5	2	no	0	0	melee	melee_blade	piercing	spear	,	25	0.6	-	-	-	spear, spear_bonus_8	0	0	no	0	0	no	melee_simple	blunt	none	,	25	1	-	-	-	no	0	1	6	flesh	0	0	flesh	2	1	-2	3	2	2	3	normal	trained	30	0	-	-	1	310	125	75	60	310	4	70	-	0, 1, 2, 3	Levy_Spearmen	turks	turks	turks	turks	-	1
venetian_albanian_cavalry	Venetian Light Cavalry	Cimarioti	From Albania, they were mercenaries like the Stradiotti Cavalry. They were very popular with nations like the Venetians who due to their homelands lacked any real cavalry. 	PLACEHOLDER LIGHT CAVALRY	light cavalry	large, cheap, medium stats	-	-	Venice, Rebels	Albania, Croatia	high, late	-	freemen	levy		BASE:n/a, UP1: leather, UP2: mail/brigandine, UP3: none, SHIELD: , HELMET: 	Lanzalonga	military dagger	Stradioti	spear/mace	-	-	cavalry	light	light	English	main_cavalry	-	-	Hobilars	32	0	1	-	-	-	-	-	-	pony	elephant -4, camel -4	none	sea_faring, hide_forest, can_withdraw, can_formed_charge, general_unit	2, 4.4	3, 6	4	square	1	0	7	3	no	0	0	melee	melee_blade	piercing	spear	,	25	1	-	-	-	no	7	2	no	0	0	melee	melee_blade	piercing	sword	,	25	1	-	-	-	no	4	3	0	leather	0	0	flesh	3	0	-2	-4	0	5	3	normal	untrained	45	0	3500	1250	1	280	150	90	70	280	4	70	-	1, 2	Hobilars	venice, byzantium, slave	venice, byzantium, slave	venice, byzantium, slave	venice, byzantium, slave	-	1
venetian_elite_militia	Elite Venetian Militia	Guardia della Quarantia	Though Venice was famous for its navy, its army was equally effective. In the 13th century, most Italian city states were already hiring mercenaries, but Venetian troops were still recruited from the lagoon, augmented by cavalry auxillaries from Dalmatia such as the famous Schiavoni. The register of 1338 estimated that 30,000 Venetian men were capable of bearing arms; many of these were skilled crossbowmen, amongst these however were elite guardsmen that protected the Republic government, even from itself, due to the common conspiracies between rival mercantile families. The Quarantia was the Supreme Tribunal office also known as the the Council of the Forty, formerly established in 1179. Its main purpose was a form of senate, although more keyed to maintaining rigid legal controls on all citizens. The office was naturally not immune to corruption or infiltration by the signoria families, however as an ideal it was a bastion of the government. The Guardia were the city police, responsible for high level militia duties, guarding the banks and the important members of state.	PLACEHOLDER HEAVY INFANTRY	heavy infantry	"palace guard"	-	-	venice	Venice	all	yes	freemen	militia		BASE:mail/gambeson, UP1: heavy mail, UP2: partial plate, UP3: n/a, SHIELD: , HELMET: 	guisarme	arming sword/warhammer	Venetian Heavy Infantry	war hammer	none for now	-	infantry	heavy	heavy	English	main_infantry	-	-	Dismounted_Feudal_Knights	48	0	1.2	-	-	-	-	-	-	-	-	limited recruitment	sea_faring, hide_forest, hardy, can_withdraw, general_unit	 1.2, 1.2	2.4, 2.4	3	square	1	0	13	3	no	0	0	melee	melee_blade	piercing	sword	,	25	1	-	-	-	no	0	0	no	0	0	no	melee_simple	blunt	none	,	25	1	-	-	-	no	7	8	6	metal	0	0	flesh	5	1	-2	3	2	5	9	normal	trained	30	0	1500	875	1	570	225	90	70	570	4	140	-	3, 4	Dismounted_Feudal_Knights	venice	venice	venice	venice	-	1
venetian_marines	Oltremarini 	Oltremarini 	Though Venice was famous for its navy, its army was equally effective. In the 13th century, most Italian city states already were hiring mercenaries, but Venetian troops were still recruited from the lagoon, plus feudal levies from Dalmatia (the very famous Schiavoni or Oltremarini) and Istria. The Fanti da mar was the marine corps of the Republic. Their creation is traced back to the time of the Fourth Crusade when the Doge Enrico Dandolo ordered constituted a regiment of ten companies, variously deployed on ships. This body took part in the subsequent Siege of Constantinople (1203-1204). They wore a red jacket, blue shirt and pants, trendy ungara, black cap with bow and boots. In times of emergency, all males between seventeen and sixty years were registered and their weapons were surveyed, with those called to actually fight being organized into companies of twelve. The register of 1338 estimated that 30,000 Venetian men were capable of bearing arms; many of these were skilled crossbowmen. As in other Italian cities, aristocrats and other wealthy men were cavalrymen while the city's conscripts fought as infantry. By 1450, more than 3,000 Venetian merchant ships were in operation. Most of these could be converted when necessary into either warships or transports. The government required each merchant ship to carry a specified number of weapons (mostly crossbows and javelins) and armour; merchant passengers were also expected to be armed and to fight when necessary. A reserve of some 25 (later 100) war-galleys was maintained in the Arsenal. Galley slaves did not exist in medieval Venice, the oarsmen coming from the city itself or from its possessions, especially Dalmatia. Those from the city were chosen by lot from each parish, their families being supported by the remainder of the parish while the rowers were away. Debtors generally worked off their obligations rowing the galleys. Rowing skills were encouraged through races and regattas.	PLACEHOLDER ARCHER UNIT	archers	top level army backbone, cheap, small unit, good stats-melée	-	-	venice	-	high, late	-	freemen	freemen		BASE:brigandine, UP1: partial mail, UP2: partial plate, UP3: , SHIELD: buckler, HELMET: mixed	longbow	cinquedea 	-	-	-	-	infantry	missile	light	English	main_missile	-	tiny	Peasant_Archers	48	0	0.8	-	-	-	-	-	-	-	-	-	sea_faring, hide_forest, can_withdraw, general_unit	 1.2, 1.2	2.4, 2.4	4	square	1	0	5	1	arrow	120	30	missile	missile_mechanical	piercing	none	,	25	1	-	-	-	no	2	1	no	0	0	melee	melee_simple	piercing	knife	,	25	1.8	-	-	-	no	0	1	0	flesh	0	0	flesh	2	1	-2	3	2	5	3	normal	trained	30	0	-	-	1	220	100	65	50	220	4	50	-	0, 1, 2	Peasant_Archers	venice	venice	venice	venice	-	1
venetian_pike_guards	Venetian Town Guards	Schiavoni	Schiavoni is an Italian ethnonym literally meaning "Slav" in Old Italian: originally, this term indicated origins in the Slavic lands of Dalmatia and Istria, when under the rule of the Republic of Venice. The majority of these men were fishermen along the coast who in Venice's earlier days were 'Dalmatian pirates', or soldiers of the smaller Maritime Republics that dotted the coast.	PLACEHOLDER LIGHT INFANTRY	light infantry	Regional Militia of Slavs	-	-	Venice, Rebels	Northern Yugoslavia	high, late	-	freemen	militia		BASE:n/a, UP1: leather, UP2: mail/brigandine, UP3: none, SHIELD: , HELMET: 	guisarme	military dagger	pike militia	pike/sword	-	-	infantry	spearmen	light	English	main_spear	-	-	Levy_Spearmen	60	0	1	-	-	-	-	-	-	-	-	spear wall	sea_faring, hide_forest, can_withdraw, general_unit	 1.2, 1.2	2.4, 2.4	5	square, schiltrom	1	0	5	2	no	0	0	melee	melee_blade	piercing	spear	,	25	0.6	-	-	-	spear, spear_bonus_8	0	0	no	0	0	no	melee_simple	blunt	none	,	25	1	-	-	-	no	0	1	6	flesh	0	0	flesh	2	1	-2	3	2	2	3	normal	trained	30	0	1500	875	1	310	125	75	60	310	4	70	-	0, 1, 2, 3	Levy_Spearmen	venice, byzantium, slave	venice, byzantium, slave	venice, byzantium, slave	venice, byzantium, slave	-	1
Venetian_selectees	Cernide	Cernide	The cernide or cernida (also known as the cranide in Dalmatia) were territorial armies of the Veneto and Istria that annually received some military training. The name cernida derives from the fact that the one or two young men were chosen (cerniti, or Italian for selections) for every ten from among the young men resident in these areas. These units could thus be mobilized quickly, unlike the army, which was slower to recruit and slower moving. They were formed of soldiers on annual service, with an obligation to gather for brief training periods four times a year, and accounted in total for about 30,000 men.	PLACEHOLDER HEAVY INFANTRY	heavy infantry	huge, cheap, large rec pool, good morale	-	-	venice	-	all	-	freemen	freemen		BASE:brigandine, UP1: upgraded brigandine, UP2: none, UP3: none, SHIELD: pavisse, HELMET: yes	guisarme	arming sword	-	-	-	-	infantry	spearmen	light	English	main_spear	-	100	Levy_Spearmen	60	0	1	-	-	-	-	-	-	-	-	shieldwall or  phalanx	sea_faring, hide_forest, can_withdraw, general_unit	 1.2, 1.2	2.4, 2.4	5	square, schiltrom	1	0	5	2	no	0	0	melee	melee_blade	piercing	spear	,	25	0.6	-	-	-	spear, spear_bonus_8	0	0	no	0	0	no	melee_simple	blunt	none	,	25	1	-	-	-	no	0	1	6	flesh	0	0	flesh	2	1	-2	3	2	-	3	normal	trained	30	0	1000	700	1	310	125	75	60	310	4	70	-	0, 1, 2, 3	Levy_Spearmen	venice	venice	venice	venice	-	1
victual_brother_pirates	Victual Brothers pirates	Vitaliener	The Victual Brothers were a multinational freebooter guild, they were at first hired by the Dukes of Mecklenburg and the Hanseatic League to harass Danish shipping, especially when Albrecht of Mecklenburg came to the throne of Sweden. In 1393 they sacked the town of Bergen for the first time in its history and in 1394 they conquered Malmö. All along the Rostock coast they held harbours and outposts, even holding ground in Frisia and Finland. In 1395 Queen Margaret of Denmark ascended the Swedish throne and unified Scandinavia under the Kalmar Union, she hired Richard II’s English navy to fight back the Victuals and in 1398 she invited the Teutonic Order to invade and purge the entire island, ending the guild for good and opening Wisby, their main base up to the machinations of the Hansa.	PLACEHOLDER LIGHT INFANTRY	light infantry	tiny unit, tiny rec pool, high stats	-	-	NE	Gotland, Stettin, Utrecht	high, late	yes	freemen	elite		BASE:mail, UP1: heavy mail, UP2: partial plate, UP3: none, SHIELD: , HELMET: 	crossbow	arming sword	crossbowmen	crossbow/sword	-	http://www.magellanworld.net/deutschland_kultur_stoertebeker4.jpg	infantry	spearmen	light	English	main_spear	-	-	Levy_Spearmen	60	0	1	-	-	-	-	-	-	-	-	hide	sea_faring, hide_forest, can_withdraw, general_unit	 1.2, 1.2	2.4, 2.4	5	square, schiltrom	1	0	5	2	no	0	0	melee	melee_blade	piercing	spear	,	25	0.6	-	-	-	spear, spear_bonus_8	0	0	no	0	0	no	melee_simple	blunt	none	,	25	1	-	-	-	no	0	1	6	flesh	0	0	flesh	2	1	-2	3	2	-	3	normal	trained	30	0	1000	700	1	310	125	75	60	310	4	70	-	0, 1, 2, 3	Levy_Spearmen	northern_european	northern_european	northern_european	northern_european	-	1
wallachian_horsearchers	wallachian horsearchers	Calarasi	PLACEHOLDER HEAVY INFANTRY	PLACEHOLDER HEAVY INFANTRY	horse archers	huge, cheap, large rec pool, good morale	-	-	Slave	eastern balkans	-	-	freemen	levy		BASE:silk, UP1: leather cuirass, UP2: chainmail, UP3: lamellar, SHIELD: , HELMET: 	Composite bow	scimitar/metalheaded mace	-	-	-	-	cavalry	missile	light	English	main_missile	-	-	Cuman_Horse_Archers	32	0	1	-	-	-	-	-	-	fast pony	elephant -4, camel -4	-	sea_faring, hide_forest, can_withdraw, cantabrian_circle, mercenary_unit, general_unit	2, 4.4	3, 6	3	square	1	0	6	1	cav_composite_arrow	125	25	missile	missile_mechanical	piercing	none	,	25	1	-	-	-	no	6	2	no	0	0	melee	melee_blade	piercing	sword	,	25	1	-	-	-	no	0	3	0	flesh	0	0	flesh	0	0	0	-6	1	4	3	normal	untrained	45	0	-	-	1	380	180	90	70	380	4	90	-	0	Cuman_Horse_Archers	slave	slave	slave	slave	-	1
wallachian_morningstars	wallachian morningstars	Maciucari 	PLACEHOLDER HEAVY INFANTRY	PLACEHOLDER HEAVY INFANTRY	heavy infantry	Heavy two-handed spiked mace (similar to Dutch geldons)	-	-	Slave	eastern balkans	high, late	-	freemen	militia		BASE:mail hauberk, UP1: gambeson, UP2: coat of plates, UP3: full plate, SHIELD: kite, HELMET: yes	metalheaded mace	sword	-	-	-	-	infantry	heavy	heavy	English	main_infantry	-	-	Dismounted_Feudal_Knights	48	0	1.2	-	-	-	-	-	-	-	-	excellent morale, armour crushing, armoured	sea_faring, hide_forest, hardy, can_withdraw, general_unit	 1.2, 1.2	2.4, 2.4	3	square	1	0	13	3	no	0	0	melee	melee_blade	piercing	sword	,	25	1	-	-	-	no	0	0	no	0	0	no	melee_simple	blunt	none	,	25	1	-	-	-	no	7	8	6	metal	0	0	flesh	5	1	-2	3	2	-	9	normal	trained	30	0	1500	875	1	570	225	90	70	570	4	140	-	3, 4	Dismounted_Feudal_Knights	slave	slave	slave	slave	-	1
wallachian_spearmen	wallachian spearmen	Strajeri	PLACEHOLDER LIGHT INFANTRY	PLACEHOLDER LIGHT INFANTRY	light infantry	huge, cheap, large rec pool, good morale	-	-	Slave	eastern balkans	-	-	freemen	levy		BASE:gambeson, UP1: brigandine, UP2: heavy brigandine, UP3: none, SHIELD: pavisse, HELMET: yes	Lanzalonga	military axe short	-	-	Hussar shield/use hussar model	-	infantry	spearmen	light	English	main_spear	-	-	Levy_Spearmen	60	0	1	-	-	-	-	-	-	-	-	-	sea_faring, hide_forest, can_withdraw, general_unit	 1.2, 1.2	2.4, 2.4	5	square, schiltrom	1	0	5	2	no	0	0	melee	melee_blade	piercing	spear	,	25	0.6	-	-	-	spear, spear_bonus_8	0	0	no	0	0	no	melee_simple	blunt	none	,	25	1	-	-	-	no	0	1	6	flesh	0	0	flesh	2	1	-2	3	2	2	3	normal	trained	30	0	-	-	1	310	125	75	60	310	4	70	-	0, 1, 2, 3	Levy_Spearmen	slave, hungary	slave, hungary	slave	slave	-	1
welsh_horsemen	Horsemen	Farchogion	PLACEHOLDER LIGHT CAVALRY	PLACEHOLDER LIGHT CAVALRY	light cavalry	horsemen	-	-	Regional Rebels	Wales	-	-	freemen	normal		BASE:unarmored, UP1: , UP2: , UP3: , SHIELD: , HELMET: 	Angon javelin	cavalry spear	Teulu Skirmishers	-	-	http://blogs.forteana.org/system/files/Pictish+stone.jpg	cavalry	light	light	English	main_cavalry	-	-	Hobilars	32	0	1	-	-	-	-	-	-	pony	elephant -4, camel -4	-	sea_faring, hide_forest, can_withdraw, can_formed_charge, general_unit	2, 4.4	3, 6	4	square	1	0	7	3	no	0	0	melee	melee_blade	piercing	spear	,	25	1	-	-	-	no	7	2	no	0	0	melee	melee_blade	piercing	sword	,	25	1	-	-	-	no	4	3	0	leather	0	0	flesh	3	0	-2	-4	0	-	3	normal	untrained	45	0	3500	1250	1	280	150	90	70	280	4	70	-	1, 2	Hobilars	slave	slave	slave	slave	-	1
welsh_infantry	Warriors	Rhyfelwyr	PLACEHOLDER LIGHT INFANTRY	PLACEHOLDER LIGHT INFANTRY	light infantry	soldiers	-	-	Regional Rebels	Wales	all	-	freemen	elite		BASE:gambeson, UP1: brigandine, UP2: heavy brigandine, UP3: none, SHIELD: kite, HELMET: yes	infantry spear	military axe short	Meirionnydd_Spearmen	-	-	-	infantry	spearmen	light	English	main_spear	-	-	Levy_Spearmen	60	0	1	-	-	-	-	-	-	-	-	-	sea_faring, hide_forest, can_withdraw, general_unit	 1.2, 1.2	2.4, 2.4	5	square, schiltrom	1	0	5	2	no	0	0	melee	melee_blade	piercing	spear	,	25	0.6	-	-	-	spear, spear_bonus_8	0	0	no	0	0	no	melee_simple	blunt	none	,	25	1	-	-	-	no	0	1	6	flesh	0	0	flesh	2	1	-2	3	2	-	3	normal	trained	30	0	1000	700	1	310	125	75	60	310	4	70	-	0, 1, 2, 3	Levy_Spearmen	slave	slave	slave	slave	-	1
welsh_shieldbearers	Shields	Tharianau	PLACEHOLDER HEAVY INFANTRY	PLACEHOLDER HEAVY INFANTRY	heavy infantry	shields	-	-	Regional Rebels	Wales	1300	yes	freemen	elite		BASE:gambeson, UP1: brigandine, UP2: heavy brigandine, UP3: full mail, SHIELD: heater, HELMET: yes	guisarme	estoc	Morgannwg_Spearmen	-	-	http://www.britsattheirbest.com/images/h_knight_fitzwalter_35-w.jpg	infantry	heavy	heavy	English	main_infantry	-	-	Dismounted_Feudal_Knights	48	0	1.2	-	-	-	-	-	-	-	-	-	sea_faring, hide_forest, hardy, can_withdraw, general_unit	 1.2, 1.2	2.4, 2.4	3	square	1	0	13	3	no	0	0	melee	melee_blade	piercing	sword	,	25	1	-	-	-	no	0	0	no	0	0	no	melee_simple	blunt	none	,	25	1	-	-	-	no	7	8	6	metal	0	0	flesh	5	1	-2	3	2	-	9	normal	trained	30	0	1000	700	1	570	225	90	70	570	4	140	-	3, 4	Dismounted_Feudal_Knights	slave	slave	slave	slave	-	1
croatian_light_cav	Croat light cavalry	Hrvatska konjica	PLACEHOLDER LIGHT CAVALRY	PLACEHOLDER LIGHT CAVALRY	light cavalry	Croatian light cavalry	-	-	Regional	Croatia	early, high	-	freemen 	elite		BASE:mail, UP1: full mail , UP2: none, UP3: none, SHIELD: , HELMET: 	cavalry spear	arming sword	mounted sergeants ug1	spear/sword	-	-	cavalry	light	light	English	main_cavalry	-	-	Hobilars	32	0	1	-	-	-	-	-	-	pony	elephant -4, camel -4	good charge, fast moving	sea_faring, hide_forest, can_withdraw, can_formed_charge, general_unit	2, 4.4	3, 6	4	square	1	0	7	3	no	0	0	melee	melee_blade	piercing	spear	,	25	1	-	-	-	no	7	2	no	0	0	melee	melee_blade	piercing	sword	,	25	1	-	-	-	no	4	3	0	leather	0	0	flesh	3	0	-2	-4	0	-	3	normal	untrained	45	0	3500	1250	1	280	150	90	70	280	4	70	-	1, 2	Hobilars	all, slave	all, slave	all, slave	all, slave	-	1
saharan_archers	Mande Archers	Dannoolu	PLACEHOLDER ARCHER UNIT	PLACEHOLDER ARCHER UNIT	archers	Members of the hunter warrior caste in Mandé society.	-	-	Regional Rebels	Takrur_Province, Gao_Province, Kumbi_Province	all	-	freemen 	normal		BASE:none, UP1: , UP2: , UP3: , SHIELD: , HELMET: 	Shortbow	knife/dagger	-	-	-	-	infantry	missile	light	English	main_missile	-	-	Peasant_Archers	48	0	0.8	-	-	-	-	-	-	-	-	-	sea_faring, hide_forest, can_withdraw, general_unit	 1.2, 1.2	2.4, 2.4	4	square	1	0	5	1	arrow	120	30	missile	missile_mechanical	piercing	none	,	25	1	-	-	-	no	2	1	no	0	0	melee	melee_simple	piercing	knife	,	25	1.8	-	-	-	no	0	1	0	flesh	0	0	flesh	2	1	-2	3	2	-	3	normal	trained	30	0	1000	700	1	220	100	65	50	220	4	50	-	0, 1, 2	Peasant_Archers	slave	slave	slave	slave	-	1
saharan_tribe_cavalry	Kanem tribesmen	Zaghawa	PLACEHOLDER LIGHT CAVALRY	PLACEHOLDER LIGHT CAVALRY	light cavalry	huge unit, cheap, good morale	-	-	Regional Rebels	Murzuq_Province	all	-	freemen 	normal		BASE:none, UP1: padded, UP2: , UP3: , SHIELD: yes , HELMET: 	Assegai javelin	cavalry spear	-	-	-	-	cavalry	light	light	English	main_cavalry	-	-	Hobilars	32	0	1	-	-	-	-	-	-	pony	elephant -4, camel -4	-	sea_faring, hide_forest, can_withdraw, can_formed_charge, general_unit	2, 4.4	3, 6	4	square	1	0	7	3	no	0	0	melee	melee_blade	piercing	spear	,	25	1	-	-	-	no	7	2	no	0	0	melee	melee_blade	piercing	sword	,	25	1	-	-	-	no	4	3	0	leather	0	0	flesh	3	0	-2	-4	0	-	3	normal	untrained	45	0	-	-	1	280	150	90	70	280	4	70	-	1, 2	Hobilars	slave	slave	slave	slave	-	1
scottish_chief_cav	warlike chiefs	Bellatores Capitalis	Clan chiefs would usually only fight leading their clans. But with the emergence of national army organisation and the regulating of levies, militias and feudal service, especially under Norman rule- the crown required a system of military recruitment based on social classes, land ownership, and local authority. In this way, local lords could be called up from an entire district in a similar fashion to the English draft of the 'hundred' where a champion from each hundred people (usually the village 'headman') would be equipped by his neighbourhood. In this way the chiefs formed a band of good, solid soldiers. The only drawback to this system was that it totally overlooked clan politics and rivalries, the Norman lords- ignorant of such complexities, failed to realise that this could undermine discipline and organisation in such a competitive assembly of warriors.	PLACEHOLDER HEAVY CAVALRY	heavy cavalry	expensive, small unit, good morale, good endurance, good in melée, no real charge bonus	-	-	Scotland	Perth, Elgin	all	yes	Gaelic Chieftains*	trained		BASE:leather, gambeson, UP1: mail, UP2: heavy mail, UP3: , SHIELD: , HELMET: 	Angon javelin	 arming sword	Teulu Skirmishers	-	poor discipline/morale	http://farm4.static.flickr.com/3-1-/2952597616_5ac55b99cd_o.jpg	cavalry	heavy	heavy	English	main_cavalry	-	-	Feudal_Knights	32	0	1	-	-	-	-	-	-	barded horse	elephant -4, camel -4	-	sea_faring, hide_forest, hardy, can_withdraw, can_formed_charge, knight, general_unit	2, 4.4	3, 6	2	square, wedge	1	0	10	6	no	0	0	melee	melee_blade	piercing	sword	,	25	1	-	-	-	no	11	4	no	0	0	melee	melee_blade	piercing	sword	,	25	1	-	-	-	no	7	5	4	metal	0	0	flesh	5	0	-2	-4	0	-	9	impetuous	trained	45	0	5250	185	1	730	250	120	95	730	4	180	-	3, 4	Feudal_Knights	scotland	scotland	scotland	scotland	-	1
persian_vigilantes	Vigilantes	ʿAyyārān	The ʿayyārān have often been confused with the ḡāzīs and fetyān. This is incorrect but explicable. The ḡāzīs, being volunteers for holy war, were only important in frontier regions, at first mainly in Central Asia where they faced the pagan Turks. Although they were recruited from town-dwellers and concentrated in towns, they had no links with the urban social organisations. Conversely the ʿayyārān had nothing to do with holy war. In the frontier regions, however, the two elements were obviously bound to become more or less intermixed, whereas in the towns on the Iranian plateau no such process occurred. There can be little doubt as to their pre-Islamic origin, not only because in later times they were said to have certain distinctively Iranian customs, but above all because in the Islamic period up to the Mongol invasion they were only to be found in territories which had once belonged to the Sassanian Empire. Ayyarun fought for Islam in Asia, though most of the writing about them centres on their Baghdad activities of the 10th to the 12th centuries. Baghdad was ruled by the Buyids (945–1055), and was a very lawless city, caused by fighting between Sunnis and Shi'ites. They did many terrible things such as extorting taxes on roads and markets, burning wealthy quarters and markets, and looting the homes of the rich by night. For several years (1028–33), Al-Burjumi and Ibn al-Mawsili, leaders of the 'ayyarun, ruled the city due to governmental instability. The 'ayyarun have been commonly called thieves and robbers, though these activities are highlighted during times of weak government and civil war, when their role as a military force most likely made them fight on multiple sides, angering many. During times of more stable government, their unlawful activities decreased, and when the Seljuqs ruled in the 12th century, their activities almost ceased. The 'ayyarun also made war against much of society in reaction to social injustices. Outside of Baghdad, the 'ayyarun were closely allied with the middle class, and helped maintain the current order. The Saffarids (861-1003) of eastern Iran were in fact an 'ayyarun dynasty. They are thought by some historians to have contributed to the weakening of Baghdad, clearing the way for the horrific destruction of the city by the Mongols. The term kāka and its cognate kākagi are common words in Afghan Persian (or Dari) and are roughly equivalent to the well-known Persian words, ʿayyār (q.v.) and ʿayyāri, and javānmard and javānmardi. The word kāka is not to be confused with kākā, though the two likely have the same root. In Afghan Persian kākā means “paternal uncle” but is also used as an honorific, reflecting the idea of “sir.” Similarly, terms such as bibi kuku, an honorific for a woman of respect, or lālā ku, an honorific for a respected master, reflect the notion of someone who is considered to be of superior status than others. Although the word ʿayyār means a vagabond or vigilante, the actual social group were characterized by the ideals of chivalry, courage, generosity, and loyalty.	PLACEHOLDER LIGHT INFANTRY	light infantry	cheap, large, good morale, low skills	-	-	Syria, Seljuks, Turks	-	-	-	ghazi	militia		BASE:unarmored, UP1: gambeson, UP2: mail, UP3: , SHIELD: , HELMET: 	Javelin	military axe short	-	-	-	-	infantry	spearmen	light	English	main_spear	-	-	Levy_Spearmen	60	0	1	-	-	-	-	-	-	-	-	-	sea_faring, hide_forest, can_withdraw, general_unit	 1.2, 1.2	2.4, 2.4	5	square, schiltrom	1	0	5	2	no	0	0	melee	melee_blade	piercing	spear	,	25	0.6	-	-	-	spear, spear_bonus_8	0	0	no	0	0	no	melee_simple	blunt	none	,	25	1	-	-	-	no	0	1	6	flesh	0	0	flesh	2	1	-2	3	2	4	3	normal	trained	30	0	-	-	1	310	125	75	60	310	4	70	-	0, 1, 2, 3	Levy_Spearmen	syria, seljuks, turks	syria, seljuks, turks	syria, seljuks, turks	syria, seljuks, turks	-	1
