portuguese_knights	Knights	Cavaleiros	PLACEHOLDER HEAVY CAVALRY	PLACEHOLDER HEAVY CAVALRY	heavy cavalry	Portuguese knights	-	-	Portugal	Portugal	all	yes	noble	elite		BASE:light mail, UP1: heavy mail, UP2: coat of plates, UP3: plate, SHIELD: , HELMET: 	cavalry spear	 arming sword	Mailed /Feudal/Portuguese Knights	lance/sword	-	-	cavalry	heavy	heavy	English	main_cavalry	-	50	Feudal_Knights	32	0	1	-	-	-	-	-	-	barded horse	elephant -4, camel -4	excellent morale, power charge	sea_faring, hide_forest, hardy, can_withdraw, can_formed_charge, knight, general_unit	2, 4.4	3, 6	2	square, wedge	1	0	10	6	no	0	0	melee	melee_blade	piercing	sword	,	25	1	-	-	-	no	11	4	no	0	0	melee	melee_blade	piercing	sword	,	25	1	-	-	-	no	7	5	4	metal	0	0	flesh	5	0	-2	-4	0	-	9	impetuous	trained	45	0	5250	1850	1	730	250	120	95	730	4	180	-	3, 4	Feudal_Knights	portugal	portugal	portugal	portugal	-	1
portugugese_bodyguards	King's Bodyguard	Guarda de Ginetes	Bodyguard of the Portuguese Kings	PLACEHOLDER HEAVY CAVALRY	heavy cavalry	royal bodyguards with javs, great	-	-	Portugal	Coimbra, Badajoz	all	yes	noble	elite		BASE:light mail, UP1: heavy mail, UP2: coat of plates, UP3: plate, SHIELD: , HELMET: 	Javelin	 arming sword	SE Bodyguard	lance/sword	-	-	cavalry	heavy	heavy	English	main_cavalry	-	50	Feudal_Knights	32	0	1	-	-	-	-	-	-	barded horse	elephant -4, camel -4	good charge, good melee combat	sea_faring, hide_forest, hardy, can_withdraw, can_formed_charge, knight, general_unit	2, 4.4	3, 6	2	square, wedge	1	0	10	6	no	0	0	melee	melee_blade	piercing	sword	,	25	1	-	-	-	no	11	4	no	0	0	melee	melee_blade	piercing	sword	,	25	1	-	-	-	no	7	5	4	metal	0	0	flesh	5	0	-2	-4	0	-	9	impetuous	trained	45	0	7000	4500	1	730	250	120	95	730	4	180	-	3, 4	Feudal_Knights	portugal	portugal	portugal	portugal	-	1
saharan_nobles	Mande Nobles	Horonu	Nobles of the Ghana and Malian Empires. By the tenth century, Ghâna was an immensely rich and prosperous empire, stretching across Senegal, Mali, and Mauritania. The ruler was acclaimed as the 'richest king in the world because of his gold' by Arab traveler Ibn Hawqal on his visit to the capital city of Kumbi Saleh in 950 AD. In the eleventh century, the kingdom began to weaken and decline. There were numerous reasons as to why. The King lost his trading monopoly, a devastating drought damaged the cattle and cultivation industries, the clans were fractured, the vassal states were rebelling, and, according to Arab tradition, it is said that Almoravid Muslims came from the North and invaded Ghâna. Other interpretations are that the Almoravid influence was gradual and did not involve any form of military takeover. In any event, following their subsequent withdrawal, new gold fields were mined further south and new trade routes were opening further east. Just as it appeared that Ghâna would reemerge, it became the target of attacks by the Susu (another Mandé people) and their leader Sumanguru. From this conflict in 1235 came the Malinké people under a new dynamic ruler, Sundiata Kéita. By the mid-thirteenth century, the once great empire of Ghâna had utterly disintegrated and soon became eclipsed by the Mali Empire of Sundiata. 	PLACEHOLDER HEAVY CAVALRY	heavy cavalry	huge unit, cheap, great morale, excellent equipment	-	-	Regional Rebels	Takrur_Province, Gao_Province, Kumbi_Province	all	yes	noble	superior		BASE:mail, UP1:heavy mail, UP2:partial plate , UP3: , SHIELD: yes, HELMET: yes	cavalry spear	Takouba	-	-	-	-	cavalry	heavy	heavy	English	main_cavalry	-	-	Feudal_Knights	32	0	1	-	-	-	-	-	-	barded horse	elephant -4, camel -4	-	sea_faring, hide_forest, hardy, can_withdraw, can_formed_charge, knight, general_unit	2, 4.4	3, 6	2	square, wedge	1	0	10	6	no	0	0	melee	melee_blade	piercing	sword	,	25	1	-	-	-	no	11	4	no	0	0	melee	melee_blade	piercing	sword	,	25	1	-	-	-	no	7	5	4	metal	0	0	flesh	5	0	-2	-4	0	-	9	impetuous	trained	45	0	5250	1850	1	730	250	120	95	730	4	180	-	3, 4	Feudal_Knights	slave	slave	slave	slave	-	1
saharan_spearmen	Mande Warriors	Numuw	Members of the blacksmith warrior caste in Mandé society.	PLACEHOLDER LIGHT INFANTRY	light infantry	medium unit, good morale, great equipment	-	-	Regional Rebels	Takrur_Province, Gao_Province, Kumbi_Province	all	-	noble	normal		BASE:none, UP1: padded, UP2: mail, UP3: , SHIELD:yes , HELMET: yes	Lanzalonga	Takouba	-	-	-	-	infantry	spearmen	light	English	main_spear	-	-	Levy_Spearmen	60	0	1	-	-	-	-	-	-	-	-	-	sea_faring, hide_forest, can_withdraw, general_unit	 1.2, 1.2	2.4, 2.4	5	square, schiltrom	1	0	5	2	no	0	0	melee	melee_blade	piercing	spear	,	25	0.6	-	-	-	spear, spear_bonus_8	0	0	no	0	0	no	melee_simple	blunt	none	,	25	1	-	-	-	no	0	1	6	flesh	0	0	flesh	2	1	-2	3	2	-	3	normal	trained	30	0	1000	700	1	310	125	75	60	310	4	70	-	0, 1, 2, 3	Levy_Spearmen	slave	slave	slave	slave	-	1
saharan_tribe_nobles	Kanembu  Nobles	Sayfawa	PLACEHOLDER LIGHT CAVALRY	PLACEHOLDER LIGHT CAVALRY	light cavalry	huge unit, cheap, great morale, charge bonus	-	-	Regional Rebels	Murzuq_Province	all	yes	Noble	superior		BASE:none, UP1: padded, UP2: , UP3: , SHIELD: yes , HELMET: 	Assegai javelin	cavalry spear	-	-	-	http://all-history.org/New%2-Folder/212/248%2-copy%2-5.jpg	cavalry	light	light	English	main_cavalry	-	-	Hobilars	32	0	1	-	-	-	-	-	-	pony	elephant -4, camel -4	-	sea_faring, hide_forest, can_withdraw, can_formed_charge, general_unit	2, 4.4	3, 6	4	square	1	0	7	3	no	0	0	melee	melee_blade	piercing	spear	,	25	1	-	-	-	no	7	2	no	0	0	melee	melee_blade	piercing	sword	,	25	1	-	-	-	no	4	3	0	leather	0	0	flesh	3	0	-2	-4	0	-	3	normal	untrained	45	0	4000	1500	1	280	150	90	70	280	4	70	-	1, 2	Hobilars	slave	slave	slave	slave	-	1
santiago_knights	Knights of the Order of Santiago	Caballeros de Santiago	PLACEHOLDER HEAVY CAVALRY	PLACEHOLDER HEAVY CAVALRY	heavy cavalry	knights	-	-	Leon-Castille	(requires post crusade)	all eras	yes	noble	elite		BASE:mail, UP1: heavy mail, UP2: plate, UP3: none, SHIELD: , HELMET: 	lance	arming sword	-	-	-	http://www.bodasdeisabel.com/gr/santimerced/Im/Caballero.jpg	cavalry	heavy	heavy	English	main_cavalry	-	50	Feudal_Knights	32	0	1	-	-	-	-	-	-	barded horse	elephant -4, camel -4	bonus against moors, poweful charge	sea_faring, hide_forest, hardy, can_withdraw, can_formed_charge, knight, general_unit	2, 4.4	3, 6	2	square, wedge	1	0	10	6	no	0	0	melee	melee_blade	piercing	sword	,	25	1	-	-	-	no	11	4	no	0	0	melee	melee_blade	piercing	sword	,	25	1	-	-	-	no	7	5	4	metal	0	0	flesh	5	0	-2	-4	0	-	9	impetuous	trained	45	0	5250	250	1	730	250	120	95	730	4	180	-	3, 4	Feudal_Knights	spain	spain	spain	spain	-	1
scandinavian_heavy_inf	Table friends	Skutilsvenir	In contrast to the outer circle of 'gestir' or 'table guests', Skutilsvenir were inner circle 'table friends'. These men would be the Hird retinue or Housecarls seated directly around the king or lord.These men were the high ranking nobles that would be commonly visited by the mobile court of the king and high Jarls, and would be themselves the hosts to their masters. They were magnates that could threaten the monarchy if they were not kept close to the crown, many were heirs and lords themselves. Wealthy and well-trained they were the best warriors in the kingdom.	PLACEHOLDER HEAVY INFANTRY	heavy infantry	small unit, good morale, good defence	-	-	DENMARK and SWEDEN (+Kalmar Union)	factional	high, late	yes	noble	elite		BASE:mail, UP1: heavy mail/Partial plate, UP2: full plate, UP3: none, SHIELD: kite, heater later (on back), HELMET: yes	Billhook	cinquedea 	Sword Staff Militia	swordstaff	-	http://warandgame.files.wordpress.com/2-1-/-5/fdrtefgtrgethr.jpg	infantry	heavy	heavy	English	main_infantry	-	-	Dismounted_Feudal_Knights	48	0	1.2	-	-	-	-	-	-	-	-	shield wall	sea_faring, hide_forest, hardy, can_withdraw, general_unit	 1.2, 1.2	2.4, 2.4	3	square	1	0	13	3	no	0	0	melee	melee_blade	piercing	sword	,	25	1	-	-	-	no	0	0	no	0	0	no	melee_simple	blunt	none	,	25	1	-	-	-	no	7	8	6	metal	0	0	flesh	5	1	-2	3	2	-	9	normal	trained	30	0	1500	875	1	570	225	90	70	570	4	140	-	3, 4	Dismounted_Feudal_Knights	denmark, sweden, norway	denmark, sweden, norway	denmark, sweden, norway	denmark, sweden, norway	-	1
scandinavian_knights	Knights	Hersar	Lords and knights- northern nobles differentiated themselves from their southern counterparts by a use of the overhand spear, often a javelin, and closed with a mace. They often wore Russian-style scale armour and lamellar, and skullcaps with chainmail aventails. Naturally they wore the heraldrics of their noble houses. By the High era they had become more alike their southern counterparts using heavy lances in a couched position and plate armour.	PLACEHOLDER HEAVY CAVALRY	heavy cavalry	expensive, small unit, good morale, good endurance, good in melée, no real charge bonus	-	-	NORWAY, DENMARK and SWEDEN	factional	high, late	yes	noble	elite		BASE:mail, UP1: heavy mail/Partial plate, UP2: none, UP3: none, SHIELD: , HELMET: 	Light lance	metalheaded mace/sword	Norman knights	lance/sword	-	http://www.medievalwarfare.info/pics/albegensian.jpg	cavalry	heavy	heavy	English	main_cavalry	-	50	Feudal_Knights	32	0	1	-	-	-	-	-	-	barded horse	elephant -4, camel -4	wedge?	sea_faring, hide_forest, hardy, can_withdraw, can_formed_charge, knight, general_unit	2, 4.4	3, 6	2	square, wedge	1	0	10	6	no	0	0	melee	melee_blade	piercing	sword	,	25	1	-	-	-	no	11	4	no	0	0	melee	melee_blade	piercing	sword	,	25	1	-	-	-	no	7	5	4	metal	0	0	flesh	5	0	-2	-4	0	-	9	impetuous	trained	45	0	5250	1850	1	730	250	120	95	730	4	180	-	3, 4	Feudal_Knights	norway, sweden, denmark	norway, sweden, denmark	norway, sweden, denmark	norway, sweden, denmark	-	1
scandinavian_mounted_sergeants	Landholders	Holdar	These were men who held land: sergeants and knights by class if not by lifestyle. Feudal law required these men to join the fight if the king called upon them, but they were not typically soldiers, more like conscripted civilians. They were wealthy enough to equip themselves properly.	PLACEHOLDER HEAVY CAVALRY	heavy cavalry	medium size unit, average, more expensive than sergeants/less common	-	-	NORWAY, DENMARK and SWEDEN	factional	all	yes	noble	levy		BASE:mail and gambeson, UP1: heavy mail, UP2: none, UP3: none, SHIELD: yes , HELMET: yes	cavalry spear	metalheaded mace	Ridire	lance/mace	-	http://www.spartacus.schoolnet.co.uk/MEDhauberkP.jpg	cavalry	heavy	heavy	English	main_cavalry	-	-	Feudal_Knights	32	0	1	-	-	-	-	-	-	barded horse	elephant -4, camel -4	snow, forests, hide	sea_faring, hide_forest, hardy, can_withdraw, can_formed_charge, knight, general_unit	2, 4.4	3, 6	2	square, wedge	1	0	10	6	no	0	0	melee	melee_blade	piercing	sword	,	25	1	-	-	-	no	11	4	no	0	0	melee	melee_blade	piercing	sword	,	25	1	-	-	-	no	7	5	4	metal	0	0	flesh	5	0	-2	-4	0	-	9	impetuous	trained	45	0	500	4000	1	730	250	120	95	730	4	180	-	3, 4	Feudal_Knights	norway, sweden, denmark	norway, sweden, denmark	norway, sweden, denmark	norway, sweden, denmark	-	1
serbian_nobles	Serbian nobles	Vlastela	Noble cavalry, flower of Serbian nobility 	PLACEHOLDER HEAVY CAVALRY	heavy cavalry	small unit, good morale, good defence	-	-	Regional Rebels	-	all	yes	noble	elite		BASE:full mail/lamellar, UP1: plate, UP2: , UP3: , SHIELD: , HELMET: 	Composite bow	Lanzalonga	-	-	-	-	cavalry	heavy	heavy	English	main_cavalry	-	-	Feudal_Knights	32	0	1	-	-	-	-	-	-	barded horse	elephant -4, camel -4	-	sea_faring, hide_forest, hardy, can_withdraw, can_formed_charge, knight, general_unit	2, 4.4	3, 6	2	square, wedge	1	0	10	6	no	0	0	melee	melee_blade	piercing	sword	,	25	1	-	-	-	no	11	4	no	0	0	melee	melee_blade	piercing	sword	,	25	1	-	-	-	no	7	5	4	metal	0	0	flesh	5	0	-2	-4	0	-	9	impetuous	trained	45	0	5250	1850	1	730	250	120	95	730	4	180	-	3, 4	Feudal_Knights	slave	slave	slave	slave	-	1
spanish_bodyguards	King's Bodyguard	Mesnada Real	Milites regis of the Castillian kings	PLACEHOLDER HEAVY CAVALRY	heavy cavalry	royal bodyguards	-	-	Leon-Castille	Burgos	all	yes	noble	elite		BASE:light mail, UP1: heavy mail, UP2: coat of plates, UP3: plate, SHIELD: , HELMET: 	cavalry spear	arming sword	SE Bodyguard	lance/sword	-	http://3.bp.blogspot.com/_DfsKa5pciwU/S6X12HA__cI/AAAAAAAAA2w/bTXw2WXDEHw/s4--/rey+de+Castilla.jpg	cavalry	heavy	heavy	English	main_cavalry	-	50	Feudal_Knights	32	0	1	-	-	-	-	-	-	barded horse	elephant -4, camel -4	good charge, good melee combat	sea_faring, hide_forest, hardy, can_withdraw, can_formed_charge, knight, general_unit	2, 4.4	3, 6	2	square, wedge	1	0	10	6	no	0	0	melee	melee_blade	piercing	sword	,	25	1	-	-	-	no	11	4	no	0	0	melee	melee_blade	piercing	sword	,	25	1	-	-	-	no	7	5	4	metal	0	0	flesh	5	0	-2	-4	0	-	9	impetuous	trained	45	0	7000	4500	1	730	250	120	95	730	4	180	-	3, 4	Feudal_Knights	spain	spain	spain	spain	-	1
spanish_knights	Knights	Caballeros	PLACEHOLDER HEAVY CAVALRY	PLACEHOLDER HEAVY CAVALRY	heavy cavalry	Knights	-	-	Leon-Castille	factional	all	yes	noble	elite		BASE:light mail, UP1: heavy mail, UP2: coat of plates, UP3: plate, SHIELD: , HELMET: 	cavalry spear	arming sword	Feudal Knights	lance/sword	-	http://img694.imageshack.us/img694/8894/caballeros.jpg	cavalry	heavy	heavy	English	main_cavalry	-	50	Feudal_Knights	32	0	1	-	-	-	-	-	-	barded horse	elephant -4, camel -4	excellent morale, power charge	sea_faring, hide_forest, hardy, can_withdraw, can_formed_charge, knight, general_unit	2, 4.4	3, 6	2	square, wedge	1	0	10	6	no	0	0	melee	melee_blade	piercing	sword	,	25	1	-	-	-	no	11	4	no	0	0	melee	melee_blade	piercing	sword	,	25	1	-	-	-	no	7	5	4	metal	0	0	flesh	5	0	-2	-4	0	-	9	impetuous	trained	45	0	5250	1850	1	730	250	120	95	730	4	180	-	3, 4	Feudal_Knights	spain	spain	spain	spain	-	1
st_george_foot_knights	Sergeants of the Order of St George	Milícies de Sant Jordi d'Alfama	PLACEHOLDER HEAVY INFANTRY	PLACEHOLDER HEAVY INFANTRY	heavy infantry	sword foot knights	-	-	Aragon	Valencia only (requires post crusade)	mid/late	yes	noble	elite		BASE:gambeson, UP1: mail, UP2: heavy mail, UP3: partial plate, SHIELD: first kite, then heater, HELMET: yes	Lanzalonga	cinquedea 	-	-	-	http://www.irishmasonicjewels.ie/Templar%2-Seal.jpg	infantry	heavy	heavy	English	main_infantry	-	100	Dismounted_Feudal_Knights	48	0	1.2	-	-	-	-	-	-	-	-	druid	sea_faring, hide_forest, hardy, can_withdraw, general_unit	 1.2, 1.2	2.4, 2.4	3	square	1	0	13	3	no	0	0	melee	melee_blade	piercing	sword	,	25	1	-	-	-	no	0	0	no	0	0	no	melee_simple	blunt	none	,	25	1	-	-	-	no	7	8	6	metal	0	0	flesh	5	1	-2	3	2	-	9	normal	trained	30	0	2500	750	1	570	225	90	70	570	4	140	-	3, 4	Dismounted_Feudal_Knights	aragon	aragon	aragon	aragon	-	1
st_george_knights	Knights of the Order of St George	Cavallers de Sant Jordi d'Alfama	PLACEHOLDER HEAVY CAVALRY	PLACEHOLDER HEAVY CAVALRY	heavy cavalry	lower class knights	-	-	Aragon	Valencia only (requires post crusade)	mid/late	yes	noble	elite		BASE:mail, UP1: heavy mail, UP2: partial plate, UP3: plate, SHIELD: first kite, then heater, HELMET: yes	lance	arming sword/metalheaded mace	-	-	-	http://www.irishmasonicjewels.ie/Templar%2-Seal.jpg	cavalry	heavy	heavy	English	main_cavalry	-	50	Feudal_Knights	32	0	1	-	-	-	-	-	-	barded horse	elephant -4, camel -4	druid	sea_faring, hide_forest, hardy, can_withdraw, can_formed_charge, knight, general_unit	2, 4.4	3, 6	2	square, wedge	1	0	10	6	no	0	0	melee	melee_blade	piercing	sword	,	25	1	-	-	-	no	11	4	no	0	0	melee	melee_blade	piercing	sword	,	25	1	-	-	-	no	7	5	4	metal	0	0	flesh	5	0	-2	-4	0	-	9	impetuous	trained	45	0	5250	1250	1	730	250	120	95	730	4	180	-	3, 4	Feudal_Knights	aragon	aragon	aragon	aragon	-	1
st_lazarus_knights	St. Lazarus knights	Fratres Militiae St.Lazarus	PLACEHOLDER HEAVY CAVALRY	PLACEHOLDER HEAVY CAVALRY	heavy cavalry	national monastic order knights, expensive, smaller unit, small pool	-	-	KoJ, France	(requires post crusade)	all eras	yes	noble	elite		BASE:heavy mail, UP1: coat of plates, UP2: plate, UP3: none, SHIELD: , HELMET: 	lance	metalheaded mace	-	-	-	http://www.irishmasonicjewels.ie/Templar%2-Seal.jpg	cavalry	heavy	heavy	English	main_cavalry	-	50	Feudal_Knights	32	0	1	-	-	-	-	-	-	barded horse	elephant -4, camel -4	druid	sea_faring, hide_forest, hardy, can_withdraw, can_formed_charge, knight, general_unit	2, 4.4	3, 6	2	square, wedge	1	0	10	6	no	0	0	melee	melee_blade	piercing	sword	,	25	1	-	-	-	no	11	4	no	0	0	melee	melee_blade	piercing	sword	,	25	1	-	-	-	no	7	5	4	metal	0	0	flesh	5	0	-2	-4	0	-	9	impetuous	trained	45	0	5250	250	1	730	250	120	95	730	4	180	-	3, 4	Feudal_Knights	papal_states, france	papal_states, france	papal_states, france	papal_states, france	-	1
st_thomas_knights	Order of St Thomas Knights	Knights of St Thomas at Acon	PLACEHOLDER HEAVY CAVALRY	PLACEHOLDER HEAVY CAVALRY	heavy cavalry	national monastic order knights, expensive, smaller unit, small pool	-	-	England, *KoJ*	(requires post crusade)	mid/late	yes	noble	elite		BASE:full mail, UP1: coat of plates, UP2: plate, UP3: none, SHIELD: heater, HELMET: yes	warhammer	metalheaded mace	-	-	Limited recruitment pool	http://images.imagestate.com/Watermark/1224442.jpg	cavalry	heavy	heavy	English	main_cavalry	-	50	Feudal_Knights	32	0	1	-	-	-	-	-	-	barded horse	elephant -4, camel -4	druid	sea_faring, hide_forest, hardy, can_withdraw, can_formed_charge, knight, general_unit	2, 4.4	3, 6	2	square, wedge	1	0	10	6	no	0	0	melee	melee_blade	piercing	sword	,	25	1	-	-	-	no	11	4	no	0	0	melee	melee_blade	piercing	sword	,	25	1	-	-	-	no	7	5	4	metal	0	0	flesh	5	0	-2	-4	0	5	9	impetuous	trained	45	0	5250	1250	1	730	250	120	95	730	4	180	-	3, 4	Feudal_Knights	england, papal_states	england, papal_states	england, papal_states	england, papal_states	-	1
swedish_heathen_lords	Swedish heathen lords	Sviakappar	PLACEHOLDER HEAVY INFANTRY	PLACEHOLDER HEAVY INFANTRY	heavy infantry	pagan resistance fighters	-	-	Sweden 	Uppsala, Skara, Linköping, Trondheim	early	yes	noble	elite		BASE:mail, UP1: heavy mail/lamellar, UP2: heavy lamellar, UP3: none, SHIELD: , HELMET: 	voulge 	arming sword	varangians	two handed axe	-	http://3.bp.blogspot.com/_iUGdRXNkkIM/TDk97ToSAkI/AAAAAAAABQ8/-LoUF9f-QJE/s16--/BattleofStamfordbridge.gif	infantry	heavy	heavy	English	main_infantry	-	-	Dismounted_Feudal_Knights	48	0	1.2	-	-	-	-	-	-	-	-	druid	sea_faring, hide_forest, hardy, can_withdraw, general_unit	 1.2, 1.2	2.4, 2.4	3	square	1	0	13	3	no	0	0	melee	melee_blade	piercing	sword	,	25	1	-	-	-	no	0	0	no	0	0	no	melee_simple	blunt	none	,	25	1	-	-	-	no	7	8	6	metal	0	0	flesh	5	1	-2	3	2	-	9	normal	trained	30	0	1500	875	1	570	225	90	70	570	4	140	-	3, 4	Dismounted_Feudal_Knights	sweden	sweden	sweden	sweden	-	1
swedish_merchant_cav	Swedish Merchant Colonists	Birkarlar	Birkarlar were semi-Swedish merchants who dominated the cultural developments and colonisation of northern Sweden from around 1300 onwards. Despite the north lacking any real feudal system, since they were no lordships and the subjects were Sami (Lapplander) nomads, the only real 'nobility' was hard cash and trade. Sweden saw the oppurtunities for good trade in the far north once Norrland had begun to stabilise. Contacts with the north were dealt a heavy blow when the Black Death hit Scandinavia through Hansa ships from England. The ghostly arrival of ships in Jutland, Denmark and Bergen where the crew were already all dead were a chilling harbinger of the devastation that was to follow. The colonisation of provinces such as Jämtland, Medelpad, Ångermanland and Härjedalen were hardest hit and the ruins of fairly newly developed villages, townships and agricultural communities would lie in ruins for hundreds of years until they were once again re-populated. Simply put, by the end of the 1300s they were not enough people in the entire country to support the economy. This was much the case as elsewhere in Europe. However the relative long-distance trade route from the Swedish capital region around Uppland to the far north mean that a taxes and more importantly a lack of tightfisted nobles meant that Sweden had an excellent resource network it could take advantage of without military or political risks.In the Lagmansting in Piteå in 1424 the lagman Nils Gustafsson (of the Rossviksätten) presided over a legal dispute between several groups of birkarlar. In the Thing document that followed the birkarlarna are referred to as lappefara (Lapp-journeymen), and 'allom Bircherlom' -'all those Birchermen'. It was also stipulated in law that merchants or these Birkarlar 'nobles' could not exact more trade commodity from the Lapps than they themselves could support in their own communities. The point was that Swedish law was very conscious of the fact that trade from the Lapps had to be in continual flow, and could not be allowed to be decimated by overuse riffua eller slitta af the fattiga Lappa'. The Birkarlar fulfilled a function as a lifeline between the north and the central government in lower Sweden, they were active between the Norwegians, the Novgorodians and were well-established even in Finland. The Portuguese Damianus a Goës who visited Sweden in the 1500s called the Birkarlar 'nobles in the north'. Their main commodities were meat, pelts, furs, hides and possibly hunting birds- all of which were extremely valuable once they reached mainland Europe or Britain, usually via the Hansa.	PLACEHOLDER LIGHT CAVALRY	light cavalry	small uncommon unit, poor charge, low upkeep	-	-	Sweden	Uppsala_Province	mid, late	yes	noble	militia		BASE:leather/mail, UP1: heavy mail, UP2: partial plate, UP3: , SHIELD: , HELMET: 	Angon javelin	arming sword	-	-	-	-	cavalry	light	light	English	main_cavalry	-	small	Hobilars	32	0	1	-	-	-	-	-	-	pony	elephant -4, camel -4	-	sea_faring, hide_forest, can_withdraw, can_formed_charge, general_unit	2, 4.4	3, 6	4	square	1	0	7	3	no	0	0	melee	melee_blade	piercing	spear	,	25	1	-	-	-	no	7	2	no	0	0	melee	melee_blade	piercing	sword	,	25	1	-	-	-	no	4	3	0	leather	0	0	flesh	3	0	-2	-4	0	-	3	normal	untrained	45	0	-	-	1	280	150	90	70	280	4	70	-	1, 2	Hobilars	sweden	sweden	sweden	sweden	-	1
sword_of_cyprus_foot_knights	Order of the sword of Cyprus foot knights	Chevaliers de l'ordre souverain de chypre	Generally assumed to have been founded by Pierre de Poitiers-Antioch de Lusignan in 1347 the order may in fact have been an earlier small branch, possibly of the Templars or Hospitallers. Under Lusignan who was at that stage only the titular Count of Tripoli the order was set up with a view to being the inner guard for the Kingdom of Cyprus and specifically rallying Latins to the Lusignan claim on the Holy Land. The idea seems to have been inspired by the Royal French 'Dauphinois Order of St. Catherine' (founded ca. 1335). When Pierre received the throne of Cyprus in 1359 he wasted no time for a full-scale Passagium Generale against Jerusalem and the other territories of the old Kingdom. Venice in particular supported his cause, offering 60,000 florins for which price ignoble merchants bought themselves into Pierre's noble order. Although largely unsuccessful in its ambitions, as for Cyprus the companies formed an elite bastion of French aristocracy.	PLACEHOLDER HEAVY INFANTRY	heavy infantry	small unit, cheap, lesser skills, good morale	-	-	Regional/catholic, Armenia (Cyprus)	Cyprus	late	yes	noble	elite		BASE:conquistador' partial plate, UP1: , UP2: , UP3: , SHIELD: , HELMET: 	voulge 	cinquedea 	squires of tripoli	-	-	http://farm3.static.flickr.com/2679/4-6-751283_2e1ac7f899_o.jpg	infantry	heavy	heavy	English	main_infantry	-	-	Dismounted_Feudal_Knights	48	0	1.2	-	-	-	-	-	-	-	-	druid NB limited medium recruitment pool	sea_faring, hide_forest, hardy, can_withdraw, general_unit	 1.2, 1.2	2.4, 2.4	3	square	1	0	13	3	no	0	0	melee	melee_blade	piercing	sword	,	25	1	-	-	-	no	0	0	no	0	0	no	melee_simple	blunt	none	,	25	1	-	-	-	no	7	8	6	metal	0	0	flesh	5	1	-2	3	2	-	9	normal	trained	30	0	1500	250	1	570	225	90	70	570	4	140	-	3, 4	Dismounted_Feudal_Knights	northern_european, southern_european, central_european, armenia	northern_european, southern_european, central_european, armenia	northern_european, southern_european, central_european, armenia	northern_european, southern_european, central_european, armenia	-	1
templar_foot_knights	Templar confratres	Confratres Templi	PLACEHOLDER HEAVY INFANTRY	PLACEHOLDER HEAVY INFANTRY	heavy infantry	Templars polearm laymen-affiliate foot knights 	-	-	All Catholics	(requires post crusade)	early, high	yes	noble	elite		BASE:mail, UP1: heavy mail, UP2: none, UP3: none, SHIELD: kite/heater on back, HELMET: yes	guisarme	arming sword	-	-	Limited recruitment pool	http://inlinethumb33.webshots.com/43296/237--2-21-1-4391629S425x425Q85.jpg	infantry	heavy	heavy	English	main_infantry	-	100	Dismounted_Feudal_Knights	48	0	1.2	-	-	-	-	-	-	-	-	druid	sea_faring, hide_forest, hardy, can_withdraw, general_unit	 1.2, 1.2	2.4, 2.4	3	square	1	0	13	3	no	0	0	melee	melee_blade	piercing	sword	,	25	1	-	-	-	no	0	0	no	0	0	no	melee_simple	blunt	none	,	25	1	-	-	-	no	7	8	6	metal	0	0	flesh	5	1	-2	3	2	-	9	normal	trained	30	0	3000	175	1	570	225	90	70	570	4	140	-	3, 4	Dismounted_Feudal_Knights	northern_european, southern_european, central_european	northern_european, southern_european, central_european	northern_european, southern_european, central_european	northern_european, southern_european, central_european	-	1
