irish_foot_sergeants	Billeted men-at-arms	Buannacht	In Ulster, the de Burgh earls adopted the buannacht (bonaght; the wages and provisions of a galloglass), which involved quartering galloglass throughout the earldom, while the earls levied the tuarastal (wages) of these elite soldiers upon the people. 	PLACEHOLDER LIGHT INFANTRY	light infantry	standard spearmen	-	-	Regional	Ireland	all	-	freemen	elite		BASE:none, UP1: padded, UP2: mail, UP3: none, SHIELD: , HELMET: 	Lanzalonga	military axe short	sergeant spearmen	speear	smaller sized unit	http://www.myarmoury.com/talk/download.php?id=27865	infantry	spearmen	light	English	main_spear	-	-	Levy_Spearmen	60	0	1	-	-	-	-	-	-	-	-	-	sea_faring, hide_forest, can_withdraw, general_unit	 1.2, 1.2	2.4, 2.4	5	square, schiltrom	1	0	5	2	no	0	0	melee	melee_blade	piercing	spear	,	25	0.6	-	-	-	spear, spear_bonus_8	0	0	no	0	0	no	melee_simple	blunt	none	,	25	1	-	-	-	no	0	1	6	flesh	0	0	flesh	2	1	-2	3	2	-	3	normal	trained	30	0	1000	700	1	310	125	75	60	310	4	70	-	0, 1, 2, 3	Levy_Spearmen	all, slave	all, slave	all, slave	all, slave	-	1
irish_guards	Guards	Cliarthairi	Profesional soldiers of Boaire, best Irish ignoble infantry.	PLACEHOLDER HEAVY INFANTRY	heavy infantry	foot sergeants	-	-	Regional	Ireland	all	-	freemen	elite		BASE:none, UP1: padded, UP2: mail, UP3: none, SHIELD: , HELMET: 	Lanzalonga	military axe short	Spear Militia	spear	smaller sized unit	http://images.yuku.com/image/png/ae8369d-12374b37f759ec15d1467ba-16e65b5-.png	infantry	heavy	heavy	English	main_infantry	-	-	Dismounted_Feudal_Knights	48	0	1.2	-	-	-	-	-	-	-	-	-	sea_faring, hide_forest, hardy, can_withdraw, general_unit	 1.2, 1.2	2.4, 2.4	3	square	1	0	13	3	no	0	0	melee	melee_blade	piercing	sword	,	25	1	-	-	-	no	0	0	no	0	0	no	melee_simple	blunt	none	,	25	1	-	-	-	no	7	8	6	metal	0	0	flesh	5	1	-2	3	2	-	9	normal	trained	30	0	1700	1000	1	570	225	90	70	570	4	140	-	3, 4	Dismounted_Feudal_Knights	all, slave	all, slave	all, slave	all, slave	-	1
irish_heavy_inf	Gallowglasses	Gallóglaigh Corrughadh	Gallowglasses, literally 'foreign warriors', were fierce men from the Eilean Siar (Western Isles), of mixed Gaelic and Viking descent. After the defeat of the Norwegians at the Battle of Largs, the inhabitants of the contested islands descended into a petty war of succession, with various descendants of the Viking nobles or Gaelic warlords forming clans of followers. When one of these clans was defeated, they were forced to flee their homes, often looking for new work as mercenary soldiers, notably in Ireland. They were protected by a helmet, a mail coat and a breastplate. They carried a great axe or a claymore. The claymore was a relatively popular weapon for the Scots, and despite its Gaelic name 'claimheamh mòr- 'great sword', the weapon itself was probably introduced by the Vikings. But in the Scottish Early Medieval period it became increasingly useful against both heavy infantry and cavalry, its primary quality being disturbing spear formations. Originally it was a tribal weapon, fielded in small numbers by specialist shock troops, however in time, even noblemen such as William Wallace used the weapon. In the later Medieval period, the longswords and Germanic zweihänder became the weapons that were key elements of pike and musket warfare. After being organised by the Scottish national army, they were formed into Corrughadh or 'battle groups' of 100 men. They were well-paid and respected men, basically tribal sergeants who would bring with them their own small band of kerns to support them.	PLACEHOLDER HEAVY INFANTRY	heavy infantry	light shock troops, large numbers, cheap, bonus against cavalry	-	-	Regional	Kirkwall, Elgin, Ireland	all	-	freemen	elite		BASE:gambeson, UP1: mail, UP2: full mail, UP3: none, SHIELD: , HELMET: 	Angon javelin	military axe twohander/longsword	Galoglasses	two handed axe		http://www.bbc.co.uk/history/british/plantation/images/ib/ib-1_t-2.jpg	infantry	heavy	heavy	English	main_infantry	-	-	Dismounted_Feudal_Knights	48	0	1.2	-	-	-	-	-	-	-	-	hide, bonus in snow, woods etc	sea_faring, hide_forest, hardy, can_withdraw, general_unit	 1.2, 1.2	2.4, 2.4	3	square	1	0	13	3	no	0	0	melee	melee_blade	piercing	sword	,	25	1	-	-	-	no	0	0	no	0	0	no	melee_simple	blunt	none	,	25	1	-	-	-	no	7	8	6	metal	0	0	flesh	5	1	-2	3	2	-	9	normal	trained	30	0	1000	700	1	570	225	90	70	570	4	140	-	3, 4	Dismounted_Feudal_Knights	all, slave	all, slave	all, slave	all, slave	-	1
irish_raiders	Foreign gaels	Gall Gaidheal	Raiders and mercenaries of mixed Norse-Gaelic origin from Western Isles	PLACEHOLDER HEAVY INFANTRY	heavy infantry	high morale	-	-	Regional	Kirkwall	early high	yes	freemen	elite		BASE:mail, UP1: full mail armor, UP2: , UP3: , SHIELD: , HELMET: 	military axe twohander	-	Gotland Footmen	-	smaller sized unit	http://upload.wikimedia.org/wikipedia/commons/3/3f/Norse-Gael_Warrior.PNG	infantry	heavy	heavy	English	main_infantry	-	-	Dismounted_Feudal_Knights	48	0	1.2	-	-	-	-	-	-	-	-	hide, bonus in snow, woods etc	sea_faring, hide_forest, hardy, can_withdraw, general_unit	 1.2, 1.2	2.4, 2.4	3	square	1	0	13	3	no	0	0	melee	melee_blade	piercing	sword	,	25	1	-	-	-	no	0	0	no	0	0	no	melee_simple	blunt	none	,	25	1	-	-	-	no	7	8	6	metal	0	0	flesh	5	1	-2	3	2	-	9	normal	trained	30	0	1000	700	1	570	225	90	70	570	4	140	-	3, 4	Dismounted_Feudal_Knights	all, slave	all, slave	all, slave	all, slave	-	1
italian_archers	Wall defenders	Guaite 	Companies for guarding city walls	PLACEHOLDER ARCHER UNIT	archers	good morale, expensive	-	-	comuni liberi, comuni toscani & Venice	northern Italy	Early, High	-	freemen	militia		BASE:padded leather , UP1: gambeson, UP2: none, UP3: none, SHIELD: none, HELMET: yes	Shortbow	shortsword	venetian archers	bow/sword	-	http://farm3.static.flickr.com/2487/4-38-18338_426d43dfb1_o.jpg	infantry	missile	light	English	main_missile	-	100	Peasant_Archers	48	0	0.8	-	-	-	-	-	-	-	-	none	sea_faring, hide_forest, can_withdraw, general_unit	 1.2, 1.2	2.4, 2.4	4	square	1	0	5	1	arrow	120	30	missile	missile_mechanical	piercing	none	,	25	1	-	-	-	no	2	1	no	0	0	melee	melee_simple	piercing	knife	,	25	1.8	-	-	-	no	0	1	0	flesh	0	0	flesh	2	1	-2	3	2	-	3	normal	trained	30	0	1000	700	1	220	100	65	50	220	4	50	-	0, 1, 2	Peasant_Archers	milan, pisa, venice	milan, pisa, venice	milan, pisa, venice	milan, pisa, venice	-	1
italian_colonist_archers	Italian colonists	Mahonesi	Itallian colonists in the Levant, they had limited military experience, being made up of merchant militias but they were well-versed in protecting their ships which were the lifblood of trade between southern Europe and the Holy Land. Saracen forces, and pirates or rival Europeans would pursue Italian vessels more than any other nation since they knew they would be carrying expensive cargo. The mahonesi therefore developed strong skills as marines, which they used to effect as garrison troops on land also.	PLACEHOLDER ARCHER UNIT	archers	merchant militia	-	-	Pisa, Genoa, Venice, Byzantium	Mediterranean cities under Italian control, Byzantium (mercs)	early, high, late	yes	freemen	militia		BASE:gambeson, UP1: mail/brigandine, UP2: , UP3: , SHIELD: , HELMET: 	crossbow	shortsword	Gasimuli	-	-	http://warandgame.files.wordpress.com/2--9/-5/slyuuyi.jpg	infantry	missile	light	English	main_missile	-	-	Peasant_Archers	48	0	0.8	-	-	-	-	-	-	-	-	-	sea_faring, hide_forest, can_withdraw, general_unit	 1.2, 1.2	2.4, 2.4	4	square	1	0	5	1	arrow	120	30	missile	missile_mechanical	piercing	none	,	25	1	-	-	-	no	2	1	no	0	0	melee	melee_simple	piercing	knife	,	25	1.8	-	-	-	no	0	1	0	flesh	0	0	flesh	2	1	-2	3	2	3	3	normal	trained	30	0	1000	700	1	220	100	65	50	220	4	50	-	0, 1, 2	Peasant_Archers	pisa, milan, venice, byzantium	pisa, milan, venice, byzantium	pisa, milan, venice, byzantium	pisa, milan, venice, byzantium	-	1
italian_gunners	Italian Gunners	Schiopetteri	PLACEHOLDER GUNNERS	PLACEHOLDER GUNNERS	gunners	Italian hand gunners unit.	-	-	CT, CL, Venice	Italy	late	-	freemen	normal		BASE:gambeson/mail, UP1: partial plate, UP2: none, UP3: none, SHIELD: n/a, HELMET: yes	handgun	shortsword	Hand gunners	hand gun/sword	-	-	infantry	missile	light	English	main_missile	-	100	Hand_Gunners	48	0	0.8	-	-	-	-	-	-	-	-	none	sea_faring, hide_forest, can_withdraw, gunpowder_unit, gunmen, general_unit	 1.2, 1.2	2.4, 2.4	4	square	1	0	13	2	hand_gun_bullet	55	20	missile	missile_gunpowder	piercing	none	, musket_shot_set,	25	1	-	-	-	ap	11	2	no	0	0	melee	melee_blade	piercing	sword	,	25	1	-	-	-	no	7	6	0	metal	0	0	flesh	5	1	-2	3	2	-	5	normal	trained	30	0	1750	1000	1	650	150	75	55	650	4	160	-	3, 4	Hand_Gunners	milan, pisa, venice, hungary, byzantium	milan, pisa, venice, hungary, byzantium	milan, pisa, venice, hungary, byzantium	milan, pisa, venice, hungary, byzantium	-	1
khazar_horse_archers	Black Khazars	Kara Qaz Ar	The Khazars' tribal structure were divided between Ak-Khazars ('White Khazars') and Kara-Khazars ('Black Khazars'). The 10th-century Muslim geographer al-Istakhri claimed that the White Khazars were strikingly handsome with reddish hair, white skin and blue eyes while the Black Khazars were swarthy verging on deep black as if they were 'some kind of Indian'. However, many Turkic nations had a similar (political, not racial) division between a 'white' ruling warrior caste and a 'black' class of commoners. George Cedrenus or Kedrenos (Greek: Γεώργιος Κεδρηνός, fl. 11th century) was the author of a Byzantine world history. His work was written either at the end of the 11th or start of the 12th century. Generally known as Compendium historiarum, or a concise history of the world, it spans the time from the Creation of the world to the accession of Isaac I Comnenus in 1057. Kedrenos documented a joint attack on the Khazar state in Kerch, ruled by Georgius Tzul, by the Byzantines and Russians in 1016. By at least the year 900 the Khazars were following the Jewish faith and had many of their customs, for instance all the Khazar rulers had Hebrew names such as Aaron, Benjamin and Joseph. In the 950s King Joseph of the Khazar nation is known to have had direct contact with the Caliphate of Cordoba in southern Spain, preserved in the documents known as the the “Khazar Correspondence”. Jewish Khazars were also mentioned in a Georgian chronicle as a group that inhabited Derbent in the late 12th century. Giovanni di Plano Carpini, a 13th century Papal legate to the court of the Mongol Khan Guyuk, gave a list of the nations the Mongols had conquered in his account. Giovanni refers to one tribe practicing the Jewish faith, the Brutahki whom he identifies as part of the Kipchak confederaion, they may have been a remnant of the Khazar state. Ibn Hawqal and al-Muqaddasi refer to Atil after 969, indicating that it may have been rebuilt. Al-Biruni (mid-11th century) reported that Atil was in ruins, and did not mention the later city of Saqsin which was built nearby, so it is possible that this new Atil was only destroyed in the middle of the 11th century. Even assuming al-Biruni's report was not an anachronism, there is no evidence that this 'new' Atil was populated by Khazars rather than by Pechenegs or a different tribe. Ibn al-Athir, who wrote around 1200, described 'the raid of Fadhlun the Kurd against the Khazars'. Fadhlun the Kurd has been identified as al-Fadhl ibn Muhammad al-Shaddadi, who ruled Arran and other parts of Azerbaijan in the 1030s. According to the account he attacked the Khazars but had to flee when they ambushed his army and killed 10,000 of his men. 	PLACEHOLDER HORSE ARCHERS	horse archers	good defence, morale, small unit, slightly more expensive	-	-	Cumans/Regional/mercenary	steppe, northern anatolia	early, high	yes	freemen	elite		BASE:padded, UP1: , UP2: , UP3: , SHIELD: , HELMET: yes	Nomad bow	Lanzalonga	-	-	-	-	cavalry	missile	light	English	main_missile	-	-	Cuman_Horse_Archers	32	0	1	-	-	-	-	-	-	fast pony	elephant -4, camel -4	cantabrian	sea_faring, hide_forest, can_withdraw, cantabrian_circle, mercenary_unit, general_unit	2, 4.4	3, 6	3	square	1	0	6	1	cav_composite_arrow	125	25	missile	missile_mechanical	piercing	none	,	25	1	-	-	-	no	6	2	no	0	0	melee	melee_blade	piercing	sword	,	25	1	-	-	-	no	0	3	0	flesh	0	0	flesh	0	0	0	-6	1	-	3	normal	untrained	45	0	-	-	1	380	180	90	70	380	4	90	-	0	Cuman_Horse_Archers	steppe, kiev, byzantium, hungary	steppe, kiev, byzantium, hungary	steppe, kiev, byzantium, hungary	steppe, kiev, byzantium, hungary	-	1
khazar_mercenaries	Muslim mercenaries in Khazaria	Arsiyah	Arsiyah, sometimes referred to as al-Arsiyya or As-yah was the name used for a group of Muslim mercenaries in the service of the Khazar Khaganate. Whether the Arsiyah were a single tribe or composed of Muslims from a number of different tribes is unclear. Also unclear is their origin; many historians regard them as deriving from Khwarazm, but some scholars point to the fact that 'As' is the Turkic term for Alans and believe that the Arsiyah were Alanic in origin. According to Muslim sources, the Arsiyah formed the core of the Khazar army and were extremely influential in Khazar politics, but these assertions may be designed to exaggerate the importance of the Muslim community in Khazaria. The Arsiyah did often act independently of their government. Part of the treaty binding them to Khazar service guaranteed that they would not be used to fight other Muslims. In 913, the Arsiyah ambushed a Viking fleet that had been granted passage to the Caspian Sea by the Khazar government, wiping out thousands of Rus warriors.	PLACEHOLDER HEAVY CAVALRY	horse archers	improved melee, good defence, morale, small unit	-	-	CUMANS	steppe	early, high	-	freemen	Trained 		BASE:mail, UP1: , UP2: , UP3: , SHIELD: , HELMET: 	Nomad bow	scimitar/metalheaded mace	-	-	-	-	cavalry	heavy	heavy	English	main_cavalry	-	-	Feudal_Knights	32	0	1	-	-	-	-	-	-	barded horse	elephant -4, camel -4	cantabrian	sea_faring, hide_forest, hardy, can_withdraw, can_formed_charge, knight, general_unit	2, 4.4	3, 6	2	square, wedge	1	0	10	6	no	0	0	melee	melee_blade	piercing	sword	,	25	1	-	-	-	no	11	4	no	0	0	melee	melee_blade	piercing	sword	,	25	1	-	-	-	no	7	5	4	metal	0	0	flesh	5	0	-2	-4	0	-	9	impetuous	trained	45	0	-	-	1	730	250	120	95	730	4	180	-	3, 4	Feudal_Knights	cumans, hungary	cumans	cumans	cumans	-	1
kiev_archers	Russian middle men	Molodshie liudi 	In the Kievan period, in a category below muzhi ['men'] were the liudi [people]. Their weregild in the Russkaia Pravda was the same as the non-service aristocracy. Precise definitions of this class are hard to come by. They seem to have been moderately well-to-do urban or rural people, with wealth based on industrial enterprises, trade, or land ownership. They had no special legal privileges. The lower classes in Kievan society were made up of diverse rural and urban elements. The weregild for these lower-class freemen was fixed at 5 grivnas. This 'price-bracket' of freemen (between 5 and 40 grivnas) were in cities, called molodshie liudi (literally, 'junior people'). They were artisans and craftsmen, often organised into guilds and associations. The term is also very well attested in both the Russian Primary Chronicle and Novgorod Chronicles. They seem to be the same as the 'Blacks' or 'Common People' who are in no way serfs but who are contrasted with the Boyars as 'chornago', 'the common people rose against the Boyars...' (cherny na boyara). 	PLACEHOLDER ARCHER UNIT	archers	good value for money, large unit, fair in melee	-	-	Kiev	-	all eras	-	freemen	militia		BASE:studded leather, UP1: mail, UP2: heavy mail, UP3: , SHIELD: , HELMET: 	Composite bow	workman's axe	-	-	-	-	infantry	missile	light	English	main_missile	-	-	Peasant_Archers	48	0	0.8	-	-	-	-	-	-	-	-	-	sea_faring, hide_forest, can_withdraw, general_unit	 1.2, 1.2	2.4, 2.4	4	square	1	0	5	1	arrow	120	30	missile	missile_mechanical	piercing	none	,	25	1	-	-	-	no	2	1	no	0	0	melee	melee_simple	piercing	knife	,	25	1.8	-	-	-	no	0	1	0	flesh	0	0	flesh	2	1	-2	3	2	2	3	normal	trained	30	0	-	-	1	220	100	65	50	220	4	50	-	0, 1, 2	Peasant_Archers	kiev	kiev	kiev	kiev	-	1
kurdish_spearmen	Kurdish soldiers	Shahrazuriyya	The Shahrazuriyya were probably Kurds from Shahrazfir who eventually left Damascus to enter the service of al-Mughfth. Amir of Karak. Al-Nasir is reported as granting asylum to 5000 Shahrazuriyya who had deserted from the Mongol army.	PLACEHOLDER LIGHT INFANTRY	light infantry	cheap, small, good morale, good in melee	-	-	regional	-	high, late	-	freemen	trained		BASE:none, UP1: leather, UP2: n/a, UP3: n/a, SHIELD: , HELMET: 	Lanzalonga	sparth axe	-	-	-	-	infantry	spearmen	light	English	main_spear	-	-	Levy_Spearmen	60	0	1	-	-	-	-	-	-	-	-	-	sea_faring, hide_forest, can_withdraw, general_unit	 1.2, 1.2	2.4, 2.4	5	square, schiltrom	1	0	5	2	no	0	0	melee	melee_blade	piercing	spear	,	25	0.6	-	-	-	spear, spear_bonus_8	0	0	no	0	0	no	melee_simple	blunt	none	,	25	1	-	-	-	no	0	1	6	flesh	0	0	flesh	2	1	-2	3	2	-	3	normal	trained	30	0	-	-	1	310	125	75	60	310	4	70	-	0, 1, 2, 3	Levy_Spearmen	all, slave	all, slave	all, slave	all, slave	-	1
kypchak_light_cav	Kypchak	Qu çaq 	PLACEHOLDER LIGHT CAVALRY	PLACEHOLDER LIGHT CAVALRY	light cavalry	Kypchak 'cossack' etc also known as Polovsty by the Russians	-	-	Cumans/Regional/mercenary	steppe, northern anatolia	all	yes	freemen	elite		BASE:mail, UP1: , UP2: , UP3: , SHIELD: , HELMET: yes	Nomad bow	Lanzalonga	-	-	-	-	cavalry	light	light	English	main_cavalry	-	-	Hobilars	32	0	1	-	-	-	-	-	-	pony	elephant -4, camel -4	cantabrian	sea_faring, hide_forest, can_withdraw, can_formed_charge, general_unit	2, 4.4	3, 6	4	square	1	0	7	3	no	0	0	melee	melee_blade	piercing	spear	,	25	1	-	-	-	no	7	2	no	0	0	melee	melee_blade	piercing	sword	,	25	1	-	-	-	no	4	3	0	leather	0	0	flesh	3	0	-2	-4	0	-	3	normal	untrained	45	0	-	-	1	280	150	90	70	280	4	70	-	1, 2	Hobilars	steppe, kiev, byzantium, hungary	steppe, kiev, byzantium, hungary	steppe, kiev, byzantium, hungary	steppe, kiev, byzantium, hungary	-	1
levant_foot_knights	Knights of the Land 	Chevaliers de la Terre	PLACEHOLDER HEAVY INFANTRY	PLACEHOLDER HEAVY INFANTRY	heavy infantry	Foot knights	-	-	Regional/catholic	Antioch, Jerusalem, Levant coast, Cyprus	high, late	yes	freemen	elite		BASE:mail, UP1: heavy mail, UP2: , UP3: , SHIELD: , HELMET: 	guisarme	cinquedea 	dismounted knights of jerusalem	-	-	http://farm3.static.flickr.com/269-/4-6-244949_7948e-2827_o.jpg	infantry	heavy	heavy	English	main_infantry	-	-	Dismounted_Feudal_Knights	48	0	1.2	-	-	-	-	-	-	-	-	pike formation	sea_faring, hide_forest, hardy, can_withdraw, general_unit	 1.2, 1.2	2.4, 2.4	3	square	1	0	13	3	no	0	0	melee	melee_blade	piercing	sword	,	25	1	-	-	-	no	0	0	no	0	0	no	melee_simple	blunt	none	,	25	1	-	-	-	no	7	8	6	metal	0	0	flesh	5	1	-2	3	2	-	9	normal	trained	30	0	1500	875	1	570	225	90	70	570	4	140	-	3, 4	Dismounted_Feudal_Knights	northern_european, southern_european, central_european	northern_european, southern_european, central_european	northern_european, southern_european, central_european	northern_european, southern_european, central_european	-	1
levant_knights	Raider Knights	Chevalier de chevauchée	PLACEHOLDER LIGHT CAVALRY	PLACEHOLDER LIGHT CAVALRY	light cavalry	Medium militia cavalry. 	-	-	Regional/catholic	Antioch, Jerusalem, Levant coast	high, late	yes	freemen	elite		BASE:mail, UP1: heavy mail, UP2: , UP3: , SHIELD: , HELMET: 	cavalry spear	cinquedea 	constable of jerusalem	-	-	http://www.jeanne-darc.dk/img_war/battle_of_crecy/battle_of_crecy_-2.jpg	cavalry	light	light	English	main_cavalry	-	-	Hobilars	32	0	1	-	-	-	-	-	-	pony	elephant -4, camel -4	-	sea_faring, hide_forest, can_withdraw, can_formed_charge, general_unit	2, 4.4	3, 6	4	square	1	0	7	3	no	0	0	melee	melee_blade	piercing	spear	,	25	1	-	-	-	no	7	2	no	0	0	melee	melee_blade	piercing	sword	,	25	1	-	-	-	no	4	3	0	leather	0	0	flesh	3	0	-2	-4	0	-	3	normal	untrained	45	0	3500	1250	1	280	150	90	70	280	4	70	-	1, 2	Hobilars	northern_european, southern_european, central_european	northern_european, southern_european, central_european	northern_european, southern_european, central_european	northern_european, southern_european, central_european	-	1
levant_noble_cavalry	Heavy noble cavalry	Conrois echelle 	PLACEHOLDER HEAVY CAVALRY	PLACEHOLDER HEAVY CAVALRY	heavy cavalry	Heavy men-at-arms cavalry.	-	-	Regional/catholic	Antioch, Jerusalem, Levant coast	high, late	yes	freemen	elite		BASE:mail, UP1: heavy mail, UP2: partial plate, UP3: , SHIELD: , HELMET: 	cavalry spear	sparth axe	knights of edessa	-	-	http://www.thehistoryblog.com/wp-content/uploads/2-1-/11/Rochefoucauld-Grail-Gawain-in-battle.jpg	cavalry	heavy	heavy	English	main_cavalry	-	-	Feudal_Knights	32	0	1	-	-	-	-	-	-	barded horse	elephant -4, camel -4	-	sea_faring, hide_forest, hardy, can_withdraw, can_formed_charge, knight, general_unit	2, 4.4	3, 6	2	square, wedge	1	0	10	6	no	0	0	melee	melee_blade	piercing	sword	,	25	1	-	-	-	no	11	4	no	0	0	melee	melee_blade	piercing	sword	,	25	1	-	-	-	no	7	5	4	metal	0	0	flesh	5	0	-2	-4	0	-	9	impetuous	trained	45	0	5250	1850	1	730	250	120	95	730	4	180	-	3, 4	Feudal_Knights	northern_european, southern_european, central_european	northern_european, southern_european, central_european	northern_european, southern_european, central_european	northern_european, southern_european, central_european	-	1
lithuanian_missile_cav	Lithuanian Villein Cavalry	Kaimynai	PLACEHOLDER HORSE ARCHERS	PLACEHOLDER HORSE ARCHERS	horse archers	a large part of the Lithuanian army	-	-	Lithuania	-	all	-	freemen	levy		BASE:None, UP1: linen gambeson, UP2: light mail, UP3: none, SHIELD: , HELMET: 	Angon javelin	cavalry spear	-	-	-	-	cavalry	missile	light	English	main_missile	-	-	Cuman_Horse_Archers	32	0	1	-	-	-	-	-	-	fast pony	elephant -4, camel -4	fast moving, good stamina, can skirmish, bonus fighting in forests	sea_faring, hide_forest, can_withdraw, cantabrian_circle, mercenary_unit, general_unit	2, 4.4	3, 6	3	square	1	0	6	1	cav_composite_arrow	125	25	missile	missile_mechanical	piercing	none	,	25	1	-	-	-	no	6	2	no	0	0	melee	melee_blade	piercing	sword	,	25	1	-	-	-	no	0	3	0	flesh	0	0	flesh	0	0	0	-6	1	3	3	normal	untrained	45	0	400	1600	1	380	180	90	70	380	4	90	-	0	Cuman_Horse_Archers	lithuania	lithuania	lithuania	lithuania	-	1
lithuanian_regular_cav	Lithuanian Regulars	Sunkieji pëstininkai	PLACEHOLDER HEAVY INFANTRY	PLACEHOLDER HEAVY INFANTRY	heavy infantry	Lithuanian professional soldiers	-	-	Lithuania	-	high, late	-	freemen	army		BASE:linen gambeson, UP1: mail and gambeson, UP2: heavy mail/leather scales, UP3: partial plate, SHIELD: , HELMET: 	Lanzalonga	scimitar	-	-	Merged Regular Infantry and 'Heavy Infantry Spear Sergeants/Sunkieji pëstininkai' into one unit. For Unit appearance, Message me for unit pictures of the different upgrades ~Yahiko_n_Tsubame	-	infantry	heavy	heavy	English	main_infantry	-	-	Dismounted_Feudal_Knights	48	0	1.2	-	-	-	-	-	-	-	-	shield wall, Good Stamina	sea_faring, hide_forest, hardy, can_withdraw, general_unit	 1.2, 1.2	2.4, 2.4	3	square	1	0	13	3	no	0	0	melee	melee_blade	piercing	sword	,	25	1	-	-	-	no	0	0	no	0	0	no	melee_simple	blunt	none	,	25	1	-	-	-	no	7	8	6	metal	0	0	flesh	5	1	-2	3	2	3	9	normal	trained	30	0	1000	700	1	570	225	90	70	570	4	140	-	3, 4	Dismounted_Feudal_Knights	lithuania, kiev	lithuania, kiev	lithuania, kiev	lithuania, kiev	-	1
